{"$schema":"http://json-schema.org/draft-07/schema#","type":"object","properties":{"id":{"type":"integer"},"joinedTime":{"type":"string","format":"date-time"},"startedEvent":{"type":"integer"},"favouriteTeam":{"type":"null"},"playerFirstName":{"type":"string"},"playerLastName":{"type":"string"},"playerRegionId":{"type":"integer"},"playerRegionName":{"type":"string"},"playerRegionIsoCodeShort":{"type":"string"},"playerRegionIsoCodeLong":{"type":"string"},"summaryOverallPoints":{"type":"integer"},"summaryOverallRank":{"type":"integer"},"summaryEventPoints":{"type":"integer"},"summaryEventRank":{"type":"integer"},"currentEvent":{"type":"integer"},"leagues":{"type":"object","properties":{"classic":{"type":"array","items":{"type":"object","properties":{"id":{"type":"integer"},"name":{"type":"string"},"shortName":{"type":["string","null"]},"created":{"type":"string","format":"date-time"},"closed":{"type":"boolean"},"rank":{"type":"null"},"maxEntries":{"type":"null"},"leagueType":{"type":"string"},"scoring":{"type":"string"},"adminEntry":{"type":["null","integer"]},"startEvent":{"type":"integer"},"entryRank":{"type":"integer"},"entryLastRank":{"type":"integer"},"entryCanLeave":{"type":"boolean"},"entryCanAdmin":{"type":"boolean"},"entryCanInvite":{"type":"boolean"}}}},"h2h":{"type":"array","items":{}},"cup":{"type":"object","properties":{"matches":{"type":"array","items":{"type":"object","properties":{"id":{"type":"integer"},"entry1Entry":{"type":"integer"},"entry1Name":{"type":"string"},"entry1PlayerName":{"type":"string"},"entry1Points":{"type":"integer"},"entry1Win":{"type":"integer"},"entry1Draw":{"type":"integer"},"entry1Loss":{"type":"integer"},"entry1Total":{"type":"integer"},"entry2Entry":{"type":"integer"},"entry2Name":{"type":"string"},"entry2PlayerName":{"type":"string"},"entry2Points":{"type":"integer"},"entry2Win":{"type":"integer"},"entry2Draw":{"type":"integer"},"entry2Loss":{"type":"integer"},"entry2Total":{"type":"integer"},"isKnockout":{"type":"boolean"},"winner":{"type":"integer"},"seedValue":{"type":"null"},"event":{"type":"integer"},"tiebreak":{"type":"null"}}}},"status":{"type":"object","properties":{"qualificationEvent":{"type":"integer"},"qualificationNumbers":{"type":"integer"},"qualificationRank":{"type":"integer"},"qualificationState":{"type":"string"}}}}}}},"name":{"type":"string"},"kit":{"type":"null"},"lastDeadlineBank":{"type":"integer"},"lastDeadlineValue":{"type":"integer"},"lastDeadlineTotalTransfers":{"type":"integer"}}}